{
  "meta": {
    "id": "plavanie-tel",
    "title": "Условия плавания тел",
    "subtitle": "Почему гвоздь тонет, а корабль — нет",
    "subject": "физика",
    "grade": "7",
    "lang": "ru",
    "durationSec": 180,
    "tags": [
      "архимед",
      "плотность",
      "плавание"
    ],
    "version": "1.0.0"
  },
  "learning": {
    "goal": "Ученик объясняет, плавает тело или тонет, сравнивая плотности, и связывает это с кораблём и подлодкой.",
    "objectives": [
      "Сравнивать ρ тела и ρ жидкости и предсказывать исход",
      "Читать долю погружения по формуле ρт/ρж",
      "Объяснять плавание стального корабля через среднюю плотность"
    ],
    "prerequisites": [
      "понятие плотности",
      "сила тяжести"
    ],
    "misconceptions": [
      {
        "wrong": "Тяжёлое всегда тонет",
        "right": "Важна средняя плотность, а не «тяжесть вообще»",
        "howDemoShows": "Корабль vs слиток той же стали"
      },
      {
        "wrong": "Вода всегда выталкивает одинаково",
        "right": "Архимедова сила зависит от объёма погруженной части и плотности жидкости",
        "howDemoShows": "Ползунок жидкости: спирт → Мёртвое море"
      }
    ],
    "formulas": [
      {
        "id": "frac",
        "latex": "\\frac{V_{погр}}{V} = \\frac{\\rho_{т}}{\\rho_{ж}}",
        "plain": "доля объёма под водой равна плотности тела, делённой на плотность жидкости",
        "whenSay": "после того как шар стабильно плавает"
      }
    ],
    "takeaways": [
      "Исход решает сравнение плотностей",
      "У плавающего тела под водой ровно ρт/ρж объёма",
      "Подлодка меняет среднюю плотность балластом"
    ],
    "realWorld": [
      "айсберг",
      "Мёртвое море",
      "подводная лодка",
      "корабль"
    ]
  },
  "ui": {
    "theme": "edu-light",
    "layout": "scroll-lesson",
    "sections": [
      {
        "id": "hook",
        "kicker": "Загадка",
        "title": "Гвоздь тонет — корабль нет",
        "bodyHtml": "<p>Стальной гвоздь идёт ко дну. Стальной корабль — нет. В чём секрет?</p>",
        "highlight": true
      },
      {
        "id": "lab",
        "kicker": "Симулятор",
        "title": "Бассейн-лаборатория",
        "bodyHtml": "<p>Авто-демо само покажет три исхода. Сними галочку — крути сам.</p>"
      },
      {
        "id": "theory",
        "kicker": "Закон",
        "title": "Спор двух сил",
        "bodyHtml": "<p>Тяжесть вниз, Архимед вверх. Побеждает тот, чья плотность «на стороне».</p>"
      }
    ]
  },
  "simulator": {
    "engine": "compare-three-outcomes",
    "controls": [
      {
        "id": "rhoBody",
        "type": "select",
        "label": "Материал",
        "min": null,
        "max": null,
        "step": null,
        "unit": "кг/м³",
        "default": 240,
        "options": [
          {
            "value": 240,
            "label": "Пробка 240"
          },
          {
            "value": 900,
            "label": "Лёд 900"
          },
          {
            "value": 1050,
            "label": "Пластик 1050"
          },
          {
            "value": 7800,
            "label": "Сталь 7800"
          }
        ],
        "speakAs": "материал тела"
      },
      {
        "id": "rhoLiq",
        "type": "range",
        "label": "Плотность жидкости",
        "min": 800,
        "max": 1240,
        "step": 10,
        "unit": "кг/м³",
        "default": 1000,
        "speakAs": "плотность жидкости"
      }
    ],
    "readouts": [
      {
        "id": "frac",
        "label": "Погружено",
        "unit": "%",
        "format": "int",
        "colorRole": "accent"
      },
      {
        "id": "verdict",
        "label": "Вердикт",
        "unit": "",
        "format": "int",
        "colorRole": "good"
      }
    ],
    "defaults": {
      "rhoBody": 240,
      "rhoLiq": 1000
    },
    "verdictRules": [
      {
        "when": "rhoBody < 0.98 * rhoLiq",
        "text": "Плавает",
        "tone": "good"
      },
      {
        "when": "abs(rhoBody - rhoLiq) / rhoLiq <= 0.02",
        "text": "Висит в толще",
        "tone": "neutral"
      },
      {
        "when": "rhoBody > 1.02 * rhoLiq",
        "text": "Тонет",
        "tone": "warn"
      }
    ]
  },
  "autoDemo": {
    "enabledByDefault": true,
    "loop": true,
    "pauseBetweenLoopsMs": 2000,
    "labelOn": "Авто-демо",
    "labelHint": "Сними галочку, чтобы крутить ползунки сам",
    "steps": [
      {
        "id": "cork",
        "durationMs": 4500,
        "easing": "easeInOut",
        "state": {
          "rhoBody": 240,
          "rhoLiq": 1000
        },
        "highlight": [
          "rhoBody",
          "frac",
          "verdict"
        ],
        "sayId": "b-cork",
        "waitForVoice": true
      },
      {
        "id": "ice",
        "durationMs": 5000,
        "state": {
          "rhoBody": 900,
          "rhoLiq": 1000
        },
        "highlight": [
          "frac"
        ],
        "sayId": "b-ice",
        "waitForVoice": true
      },
      {
        "id": "steel",
        "durationMs": 4500,
        "state": {
          "rhoBody": 7800,
          "rhoLiq": 1000
        },
        "highlight": [
          "verdict"
        ],
        "sayId": "b-steel",
        "waitForVoice": true
      },
      {
        "id": "dead-sea",
        "durationMs": 5500,
        "state": {
          "rhoBody": 1050,
          "rhoLiq": 1240
        },
        "highlight": [
          "rhoLiq"
        ],
        "sayId": "b-deadsea",
        "waitForVoice": true
      }
    ]
  },
  "voiceScript": {
    "persona": {
      "name": "Учитель",
      "role": "дружелюбный учитель физики для 7 класса",
      "tone": "живой, ясный, без сюсюканья",
      "addressAs": "ты"
    },
    "style": {
      "pace": "normal",
      "maxSentenceWords": 18,
      "allowQuestions": true,
      "pauseAfterQuestionMs": 2200,
      "spellFormulas": true,
      "neverSay": [
        "очевидно",
        "просто запомни формулу",
        "это элементарно"
      ]
    },
    "beats": [
      {
        "id": "b-hook",
        "phase": "hook",
        "say": "Смотри. Стальной гвоздь тонет сразу. А огромный стальной корабль — спокойно плавает. Как вода решает, кого держать?",
        "onScreen": "Заголовок и хук",
        "expectStudent": "listen"
      },
      {
        "id": "b-cork",
        "phase": "demo",
        "say": "Берём пробку. Плотность двести сорок. Вода — тысяча. Пробка легче воды по плотности, поэтому всплывает и сидит почти сверху.",
        "onScreen": "Авто-демо: пробка, вердикт «Плавает»",
        "autoStepId": "cork",
        "expectStudent": "observe"
      },
      {
        "id": "b-q1",
        "phase": "question",
        "say": "А как думаешь: если взять лёд, девятьсот килограммов на куб — он утонет или будет плавать? И какая часть окажется под водой?",
        "onScreen": "Пауза, подсветка материала",
        "expectStudent": "think"
      },
      {
        "id": "b-ice",
        "phase": "answer",
        "say": "Лёд плавает. Под водой около девяноста процентов. Это и есть верхушка айсберга: почти всё скрыто.",
        "onScreen": "Лёд, погружено ~90%",
        "autoStepId": "ice",
        "expectStudent": "observe"
      },
      {
        "id": "b-steel",
        "phase": "demo",
        "say": "Сталь — семь тысяч восемьсот. Даже полностью в воде Архимед не перетягивает. Тонет.",
        "onScreen": "Сталь тонет",
        "autoStepId": "steel",
        "expectStudent": "observe"
      },
      {
        "id": "b-formula",
        "phase": "formula",
        "say": "Запомни правило. У плавающего тела доля объёма под водой равна плотности тела, делённой на плотность жидкости.",
        "onScreen": "Формула",
        "expectStudent": "listen"
      },
      {
        "id": "b-deadsea",
        "phase": "transfer",
        "say": "А если жидкость гуще — как Мёртвое море, тысяча двести сорок? Даже пластик, который в пресной воде тонул, здесь может держаться. Плотность жидкости выросла — выталкивание сильнее.",
        "onScreen": "Ползунок жидкости вправо",
        "autoStepId": "dead-sea",
        "expectStudent": "observe"
      },
      {
        "id": "b-q2",
        "phase": "question",
        "say": "Почему тогда плавает стальной корабль? Сталь же тяжелее воды.",
        "onScreen": "Карточка корабля",
        "expectStudent": "think"
      },
      {
        "id": "b-ship",
        "phase": "explain",
        "say": "Секрет в средней плотности. Внутри корпуса много воздуха. Сталь плюс воздух в среднем легче воды — поэтому корабль плавает. Переплавь в слиток — утонет.",
        "onScreen": "Корабль vs слиток",
        "expectStudent": "listen"
      },
      {
        "id": "b-outro",
        "phase": "summary",
        "say": "Итог. Сравни плотности. Если тело легче жидкости — плавает. Равны — висит. Тяжелее — тонет. Хочешь сам — сними галочку «Авто-демо» и подергай ползунки.",
        "onScreen": "Галочка авто-демо",
        "expectStudent": "touch_ui"
      }
    ],